{
  "capabilities": [
    {
      "coverageTags": [
        "activation",
        "ambiguity",
        "glob-edge-case",
        "import-behavior",
        "nested-discovery",
        "supported-location",
        "unsupported-field"
      ],
      "evidenceStatus": ["documented", "source-derived", "observed"],
      "formatId": "agents-markdown",
      "id": "codex-cli.local-cli-single-cwd--agents-markdown",
      "negative": {
        "assertionId": "assert-agents-markdown-negative",
        "expectedState": "not-selected",
        "fixtureId": "official-codex-cli-local-cli-single-cwd-negative"
      },
      "positive": {
        "assertionId": "assert-agents-markdown-positive",
        "expectedState": "selected",
        "fixtureId": "official-codex-cli-local-cli-single-cwd-positive"
      },
      "profileId": "codex-cli",
      "supportStatus": "supported",
      "surfaceId": "codex-cli/local-cli-single-cwd"
    },
    {
      "coverageTags": [
        "activation",
        "ambiguity",
        "glob-edge-case",
        "import-behavior",
        "nested-discovery",
        "supported-location",
        "unsupported-field"
      ],
      "evidenceStatus": ["documented", "pending-observation"],
      "formatId": "claude-memory-markdown",
      "id": "claude-code.local-session--claude-memory-markdown",
      "negative": {
        "assertionId": "assert-claude-memory-markdown-negative",
        "expectedState": "not-selected",
        "fixtureId": "official-claude-code-local-session-negative"
      },
      "positive": {
        "assertionId": "assert-claude-memory-markdown-positive",
        "expectedState": "selected",
        "fixtureId": "official-claude-code-local-session-positive"
      },
      "profileId": "claude-code",
      "supportStatus": "supported",
      "surfaceId": "claude-code/local-session"
    },
    {
      "coverageTags": [
        "activation",
        "ambiguity",
        "glob-edge-case",
        "import-behavior",
        "nested-discovery",
        "supported-location",
        "unsupported-field"
      ],
      "evidenceStatus": ["documented", "pending-observation"],
      "formatId": "claude-rule-markdown",
      "id": "claude-code.local-session--claude-rule-markdown",
      "negative": {
        "assertionId": "assert-claude-rule-markdown-negative",
        "expectedState": "not-selected",
        "fixtureId": "official-claude-code-local-session-negative"
      },
      "positive": {
        "assertionId": "assert-claude-rule-markdown-positive",
        "expectedState": "selected",
        "fixtureId": "official-claude-code-local-session-positive"
      },
      "profileId": "claude-code",
      "supportStatus": "supported",
      "surfaceId": "claude-code/local-session"
    },
    {
      "coverageTags": [
        "activation",
        "ambiguity",
        "glob-edge-case",
        "import-behavior",
        "nested-discovery",
        "supported-location",
        "unsupported-field"
      ],
      "evidenceStatus": ["documented", "pending-observation"],
      "formatId": "copilot-repository-markdown",
      "id": "copilot-cli.local-terminal--copilot-repository-markdown",
      "negative": {
        "assertionId": "assert-copilot-repository-markdown-negative",
        "expectedState": "not-selected",
        "fixtureId": "official-copilot-cli-local-terminal-negative"
      },
      "positive": {
        "assertionId": "assert-copilot-repository-markdown-positive",
        "expectedState": "selected",
        "fixtureId": "official-copilot-cli-local-terminal-positive"
      },
      "profileId": "copilot-cli",
      "supportStatus": "supported",
      "surfaceId": "copilot-cli/local-terminal"
    },
    {
      "coverageTags": [
        "activation",
        "ambiguity",
        "glob-edge-case",
        "import-behavior",
        "nested-discovery",
        "supported-location",
        "unsupported-field"
      ],
      "evidenceStatus": ["documented", "conditional"],
      "formatId": "copilot-path-instructions",
      "id": "copilot-cli.local-terminal--copilot-path-instructions",
      "negative": {
        "assertionId": "assert-copilot-path-instructions-negative",
        "expectedState": "not-selected",
        "fixtureId": "official-copilot-cli-local-terminal-negative"
      },
      "positive": {
        "assertionId": "assert-copilot-path-instructions-positive",
        "expectedState": "indeterminate",
        "fixtureId": "official-copilot-cli-local-terminal-positive"
      },
      "profileId": "copilot-cli",
      "supportStatus": "supported",
      "surfaceId": "copilot-cli/local-terminal"
    },
    {
      "coverageTags": [
        "activation",
        "ambiguity",
        "glob-edge-case",
        "import-behavior",
        "nested-discovery",
        "supported-location",
        "unsupported-field"
      ],
      "evidenceStatus": ["documented", "unknown"],
      "formatId": "agents-markdown",
      "id": "copilot-cli.local-terminal--agents-markdown",
      "negative": {
        "assertionId": "assert-agents-markdown-negative",
        "expectedState": "not-selected",
        "fixtureId": "official-copilot-cli-local-terminal-negative"
      },
      "positive": {
        "assertionId": "assert-agents-markdown-positive",
        "expectedState": "indeterminate",
        "fixtureId": "official-copilot-cli-local-terminal-positive"
      },
      "profileId": "copilot-cli",
      "supportStatus": "supported",
      "surfaceId": "copilot-cli/local-terminal"
    },
    {
      "coverageTags": [
        "activation",
        "ambiguity",
        "glob-edge-case",
        "import-behavior",
        "nested-discovery",
        "supported-location",
        "unsupported-field"
      ],
      "evidenceStatus": ["documented", "unknown"],
      "formatId": "claude-memory-markdown",
      "id": "copilot-cli.local-terminal--claude-memory-markdown",
      "negative": {
        "assertionId": "assert-claude-memory-markdown-negative",
        "expectedState": "not-selected",
        "fixtureId": "official-copilot-cli-local-terminal-negative"
      },
      "positive": {
        "assertionId": "assert-claude-memory-markdown-positive",
        "expectedState": "indeterminate",
        "fixtureId": "official-copilot-cli-local-terminal-positive"
      },
      "profileId": "copilot-cli",
      "supportStatus": "supported",
      "surfaceId": "copilot-cli/local-terminal"
    },
    {
      "coverageTags": [
        "activation",
        "ambiguity",
        "glob-edge-case",
        "import-behavior",
        "nested-discovery",
        "supported-location",
        "unsupported-field"
      ],
      "evidenceStatus": ["documented"],
      "formatId": "gemini-context-markdown",
      "id": "copilot-cli.local-terminal--gemini-context-markdown",
      "negative": {
        "assertionId": "assert-gemini-context-markdown-negative",
        "expectedState": "not-selected",
        "fixtureId": "official-copilot-cli-local-terminal-negative"
      },
      "positive": {
        "assertionId": "assert-gemini-context-markdown-positive",
        "expectedState": "selected",
        "fixtureId": "official-copilot-cli-local-terminal-positive"
      },
      "profileId": "copilot-cli",
      "supportStatus": "supported",
      "surfaceId": "copilot-cli/local-terminal"
    },
    {
      "coverageTags": [
        "activation",
        "ambiguity",
        "glob-edge-case",
        "import-behavior",
        "nested-discovery",
        "supported-location",
        "unsupported-field"
      ],
      "evidenceStatus": ["documented"],
      "formatId": "copilot-repository-markdown",
      "id": "copilot-vscode.local-chat--copilot-repository-markdown",
      "negative": {
        "assertionId": "assert-copilot-repository-markdown-negative",
        "expectedState": "not-selected",
        "fixtureId": "official-copilot-vscode-local-chat-negative"
      },
      "positive": {
        "assertionId": "assert-copilot-repository-markdown-positive",
        "expectedState": "selected",
        "fixtureId": "official-copilot-vscode-local-chat-positive"
      },
      "profileId": "copilot-vscode",
      "supportStatus": "supported",
      "surfaceId": "copilot-vscode/local-chat"
    },
    {
      "coverageTags": [
        "activation",
        "ambiguity",
        "glob-edge-case",
        "import-behavior",
        "nested-discovery",
        "supported-location",
        "unsupported-field"
      ],
      "evidenceStatus": ["documented", "conditional", "contradiction"],
      "formatId": "copilot-path-instructions",
      "id": "copilot-vscode.local-chat--copilot-path-instructions",
      "negative": {
        "assertionId": "assert-copilot-path-instructions-negative",
        "expectedState": "not-selected",
        "fixtureId": "official-copilot-vscode-local-chat-negative"
      },
      "positive": {
        "assertionId": "assert-copilot-path-instructions-positive",
        "expectedState": "indeterminate",
        "fixtureId": "official-copilot-vscode-local-chat-positive"
      },
      "profileId": "copilot-vscode",
      "supportStatus": "supported",
      "surfaceId": "copilot-vscode/local-chat"
    },
    {
      "coverageTags": [
        "activation",
        "ambiguity",
        "glob-edge-case",
        "import-behavior",
        "nested-discovery",
        "supported-location",
        "unsupported-field"
      ],
      "evidenceStatus": ["documented", "conditional", "model-selected"],
      "formatId": "agents-markdown",
      "id": "copilot-vscode.local-chat--agents-markdown",
      "negative": {
        "assertionId": "assert-agents-markdown-negative",
        "expectedState": "not-selected",
        "fixtureId": "official-copilot-vscode-local-chat-negative"
      },
      "positive": {
        "assertionId": "assert-agents-markdown-positive",
        "expectedState": "indeterminate",
        "fixtureId": "official-copilot-vscode-local-chat-positive"
      },